[
  {
    "id": "linkedin-premium",
    "name": "Linkedin Premium",
    "url": "https://socialimpact.linkedin.com/programs/veterans/premiumform",
    "urls": [
      "https://socialimpact.linkedin.com/programs/veterans/premiumform"
    ],
    "summary": "Military get one year free.",
    "categories": [
      "discounts",
      "brand-specific"
    ],
    "tags": [
      "brand-specific",
      "discounts"
    ],
    "eligibility": [],
    "source": {
      "type": "adoc",
      "reference": "army-benefits-unofficial-pages/modules/ROOT/pages/discounts-brand.adoc"
    },
    "addedBy": "@binbashburns",
    "addedAt": "2025-12-14T15:16:00.259679Z"
  },
  {
    "id": "home-depot",
    "name": "Home Depot",
    "url": "https://www.homedepot.com/c/military",
    "urls": [
      "https://www.homedepot.com/c/military"
    ],
    "summary": "10% off eligible purchases, up to $400 per year.",
    "categories": [
      "discounts",
      "brand-specific"
    ],
    "tags": [
      "brand-specific",
      "discounts"
    ],
    "eligibility": [],
    "source": {
      "type": "adoc",
      "reference": "army-benefits-unofficial-pages/modules/ROOT/pages/discounts-brand.adoc"
    },
    "addedBy": "@binbashburns",
    "addedAt": "2025-12-14T15:16:00.259968Z"
  },
  {
    "id": "lowes",
    "name": "Lowes",
    "url": "https://www.lowes.com/military/validation",
    "urls": [
      "https://www.lowes.com/military/validation"
    ],
    "summary": "10% off on eligible purchases.",
    "categories": [
      "discounts",
      "brand-specific"
    ],
    "tags": [
      "brand-specific",
      "discounts"
    ],
    "eligibility": [],
    "source": {
      "type": "adoc",
      "reference": "army-benefits-unofficial-pages/modules/ROOT/pages/discounts-brand.adoc"
    },
    "addedBy": "@binbashburns",
    "addedAt": "2025-12-14T15:16:00.259995Z"
  },
  {
    "id": "carhartt",
    "name": "Carhartt",
    "url": "https://www.carhartt.com/discount-program",
    "urls": [
      "https://www.carhartt.com/discount-program"
    ],
    "summary": "25% off on accessories and apparel.",
    "categories": [
      "discounts",
      "brand-specific"
    ],
    "tags": [
      "apparel",
      "brand-specific",
      "discounts"
    ],
    "eligibility": [],
    "source": {
      "type": "adoc",
      "reference": "army-benefits-unofficial-pages/modules/ROOT/pages/discounts-brand.adoc"
    },
    "addedBy": "@binbashburns",
    "addedAt": "2025-12-14T15:16:00.260015Z"
  },
  {
    "id": "lululemon",
    "name": "Lululemon",
    "url": "https://shop.lululemon.com/story/military-first-responder",
    "urls": [
      "https://shop.lululemon.com/story/military-first-responder"
    ],
    "summary": "15% off in store and online.",
    "categories": [
      "discounts",
      "brand-specific"
    ],
    "tags": [
      "apparel",
      "brand-specific",
      "discounts"
    ],
    "eligibility": [],
    "source": {
      "type": "adoc",
      "reference": "army-benefits-unofficial-pages/modules/ROOT/pages/discounts-brand.adoc"
    },
    "addedBy": "@binbashburns",
    "addedAt": "2025-12-14T15:16:00.260033Z"
  },
  {
    "id": "nike",
    "name": "Nike",
    "url": "https://www.nike.com/help/a/military-discount?cp=38695907838_search_-nike%20military%20discount-g-19646935901-152919999024-e-m---681141701486-kwd-303219766054-9005292&gad_source=1&gbraid=0AAAAADy86kOxQPTdrSsyrp0xAx1OVCqhD&gclid=EAIaIQobChMIlJCJ2f25hAMVWGBHAR1Cyga0EAAYASAAEgI2w_D_BwE&gclsrc=aw.ds",
    "urls": [
      "https://www.nike.com/help/a/military-discount?cp=38695907838_search_-nike%20military%20discount-g-19646935901-152919999024-e-m---681141701486-kwd-303219766054-9005292&gad_source=1&gbraid=0AAAAADy86kOxQPTdrSsyrp0xAx1OVCqhD&gclid=EAIaIQobChMIlJCJ2f25hAMVWGBHAR1Cyga0EAAYASAAEgI2w_D_BwE&gclsrc=aw.ds"
    ],
    "summary": "10% off online, at Nike, Converse, and Hurley stores.",
    "categories": [
      "discounts",
      "brand-specific"
    ],
    "tags": [
      "apparel",
      "brand-specific",
      "discounts"
    ],
    "eligibility": [],
    "source": {
      "type": "adoc",
      "reference": "army-benefits-unofficial-pages/modules/ROOT/pages/discounts-brand.adoc"
    },
    "addedBy": "@binbashburns",
    "addedAt": "2025-12-14T15:16:00.260052Z"
  },
  {
    "id": "adidas",
    "name": "Adidas",
    "url": "https://www.adidas.com/us/discount-programs",
    "urls": [
      "https://www.adidas.com/us/discount-programs"
    ],
    "summary": "30% off online and in store and 15% off at factory outlets.",
    "categories": [
      "discounts",
      "brand-specific"
    ],
    "tags": [
      "apparel",
      "brand-specific",
      "discounts"
    ],
    "eligibility": [],
    "source": {
      "type": "adoc",
      "reference": "army-benefits-unofficial-pages/modules/ROOT/pages/discounts-brand.adoc"
    },
    "addedBy": "@binbashburns",
    "addedAt": "2025-12-14T15:16:00.260070Z"
  },
  {
    "id": "brides-across-america",
    "name": "Brides Across America",
    "url": "https://www.bridesacrossamerica.com/",
    "urls": [
      "https://www.bridesacrossamerica.com/"
    ],
    "summary": "Free wedding dress for military member or spouses.",
    "categories": [
      "discounts",
      "brand-specific"
    ],
    "tags": [
      "apparel",
      "brand-specific",
      "discounts"
    ],
    "eligibility": [],
    "source": {
      "type": "adoc",
      "reference": "army-benefits-unofficial-pages/modules/ROOT/pages/discounts-brand.adoc"
    },
    "addedBy": "@binbashburns",
    "addedAt": "2025-12-14T15:16:00.260088Z"
  },
  {
    "id": "operation-deploy-your-dress",
    "name": "Operation Deploy Your Dress",
    "url": "https://operationdeployyourdress.org/",
    "urls": [
      "https://operationdeployyourdress.org/"
    ],
    "summary": "Provides free formal wear and accessories to servicewomen and military spouses for balls and other special events, offsetting the cost of dressing for them.",
    "categories": [
      "discounts",
      "brand-specific"
    ],
    "tags": [
      "apparel",
      "brand-specific",
      "discounts"
    ],
    "eligibility": [],
    "source": {
      "type": "adoc",
      "reference": "army-benefits-unofficial-pages/modules/ROOT/pages/discounts-brand.adoc"
    },
    "addedBy": "@binbashburns",
    "addedAt": "2025-12-14T15:16:00.260107Z"
  },
  {
    "id": "cars4heroes",
    "name": "Cars4heroes",
    "url": "https://cars4heroes.org/",
    "urls": [
      "https://cars4heroes.org/"
    ],
    "summary": "Nonprofit that awards donated vehicles to active duty in need.",
    "categories": [
      "discounts",
      "brand-specific"
    ],
    "tags": [
      "brand-specific",
      "discounts"
    ],
    "eligibility": [],
    "source": {
      "type": "adoc",
      "reference": "army-benefits-unofficial-pages/modules/ROOT/pages/discounts-brand.adoc"
    },
    "addedBy": "@binbashburns",
    "addedAt": "2025-12-14T15:16:00.260124Z"
  },
  {
    "id": "truecar-military-program",
    "name": "Truecar Military Program",
    "url": "https://military.truecar.com/?referrer_id=ZTRU000027515&gclid=Cj0KCQiA3eGfBhCeARIsACpJNU9Er6LybOampPvQBUTUThedczDttrxYQNCk-bcfj1E_soh98fmQW1MaAnsMEALw_wcB",
    "urls": [
      "https://military.truecar.com/?referrer_id=ZTRU000027515&gclid=Cj0KCQiA3eGfBhCeARIsACpJNU9Er6LybOampPvQBUTUThedczDttrxYQNCk-bcfj1E_soh98fmQW1MaAnsMEALw_wcB"
    ],
    "summary": "Special savings and benefits for military members searching for vehicles.",
    "categories": [
      "discounts",
      "brand-specific"
    ],
    "tags": [
      "brand-specific",
      "discounts"
    ],
    "eligibility": [],
    "source": {
      "type": "adoc",
      "reference": "army-benefits-unofficial-pages/modules/ROOT/pages/discounts-brand.adoc"
    },
    "addedBy": "@binbashburns",
    "addedAt": "2025-12-14T15:16:00.260142Z"
  },
  {
    "id": "vet-tix",
    "name": "Vet Tix",
    "url": "https://www.vettix.org/",
    "urls": [
      "https://www.vettix.org/"
    ],
    "summary": "Offers free concert and sports tickets to military members.",
    "categories": [
      "discounts",
      "brand-specific"
    ],
    "tags": [
      "brand-specific",
      "discounts"
    ],
    "eligibility": [],
    "source": {
      "type": "adoc",
      "reference": "army-benefits-unofficial-pages/modules/ROOT/pages/discounts-brand.adoc"
    },
    "addedBy": "@binbashburns",
    "addedAt": "2025-12-14T15:16:00.260158Z"
  },
  {
    "id": "wwe-tickets",
    "name": "WWE Tickets",
    "url": "https://community.wwe.com/service/programs/tickets-our-troops#:~:text=U.S.%20military%20personnel%20from%20the,ID%20the%20day%20of%20the",
    "urls": [
      "https://community.wwe.com/service/programs/tickets-our-troops#:~:text=U.S.%20military%20personnel%20from%20the,ID%20the%20day%20of%20the"
    ],
    "summary": "Military can claim a free ticket to any smackdown or RAW event.",
    "categories": [
      "discounts",
      "brand-specific"
    ],
    "tags": [
      "brand-specific",
      "discounts"
    ],
    "eligibility": [],
    "source": {
      "type": "adoc",
      "reference": "army-benefits-unofficial-pages/modules/ROOT/pages/discounts-brand.adoc"
    },
    "addedBy": "@binbashburns",
    "addedAt": "2025-12-14T15:16:00.260175Z"
  },
  {
    "id": "samsung",
    "name": "Samsung",
    "url": "https://www.samsung.com/us/shop/offer-program/military/",
    "urls": [
      "https://www.samsung.com/us/shop/offer-program/military/"
    ],
    "summary": "up to 30% off for military.",
    "categories": [
      "discounts",
      "brand-specific"
    ],
    "tags": [
      "brand-specific",
      "discounts"
    ],
    "eligibility": [],
    "source": {
      "type": "adoc",
      "reference": "army-benefits-unofficial-pages/modules/ROOT/pages/discounts-brand.adoc"
    },
    "addedBy": "@binbashburns",
    "addedAt": "2025-12-14T15:16:00.260192Z"
  },
  {
    "id": "apple",
    "name": "Apple",